<?xml version="1.0" encoding="UTF-8" standalone="no"?>
<?xml-stylesheet type="text/css" href="cart_ss3.css" ?>
<!DOCTYPE cart SYSTEM "demo.dtd">
<cart id="cart" xmlns:xsi="http://www.w3.org/2001/XMLSchema-instance" xsi:noNamespaceSchemaLocation="cart_ss3.xsd">

    <date id="date">22/2/2022</date>
    <grand_total id="grand">20000000</grand_total>
    <customer id="cus">
        <c_name id="a">Bui Van Tinh</c_name>
        <c_tel id="a">0972030182</c_tel>
        <c_address id="a">8 ton that thuyet</c_address>
    </customer>
    <item id="item">
        <product id="pro">
            <p_name>TV SONY 59inch</p_name>
            <qty>1</qty>
            <price>20000000</price>
        </product>

        <product id="pro">
            <p_name>TV SONY 59inch</p_name>
            <qty>1</qty>
            <price>20000000</price>
        </product>

    </item>
</cart>